item_ID,label,description,english,tag_automated,check2_tag_remove,check2_tag_add,check2_tag_new,edited_by,check1_tag_remove,check1_tag_add
618,Seit [Uhrzeit letzte Befragung oder heute morgen]: Wie geborgen fühlten Sie sich?,experience of security (time.alone.geborgen),since [time of the last survey or this morning]: how secure did you feel?,appraisal;evening;morning,,,,Milla;Ben,,
619,"Wie glücklich sind Sie damit, wie Sie Ihre Zeit verbracht haben seit [Uhrzeit letzte Befragung oder heute morgen]?",satisfaction with time spent alone that day (time.alone.zufrieden),how happy are you with how you have spent your time since [time of last survey or this morning]?,positive affect;evening;morning,,,,Milla;Ben,,appraisal
620,Seit [Uhrzeit letzte Befragung oder heute morgen]: Sind eine oder mehrere der folgenden Situationen mit Ihrem Partner aufgetreten?,reciprocal behavior in the relationship (beh.b.partner),since [time of the last survey or this morning]: have one or more of the following situations occurred with your partner?,event;evening;morning,,,,Milla;Ben,,
621,seit [uhrzeit letzte befragung oder heute morgen]: sind eine oder mehrere der folgenden situationen mit anderen personen aufgetreten?,reciprocal behavior with others (beh.b.others  (variant for other persons)),since [time of the last survey or this morning]: have one or more of the following situations occurred with other people?,event;evening;morning,,,,Milla;Ben,,
622,Von wem ging der stärkere Streit oder Konflikt aus?,initiator of fight / conflict (beh.b.partner.conflict.init),who initiated the stronger fight or conflict?,evening;morning,,,,Milla;Ben,,
623,Von wem ging der stärkere Streit oder Konflikt aus?,initiator of fight / conflict (beh.b.others.conflict.init (variant for other persons)),who initiated the stronger fight or conflict?,evening;morning,,,,Milla;Ben,,
624,Von wem ging die liebevolle Versöhnung aus?,initiator of reconciliation (beh.b.partner.recon.init),who initiated the loving reconciliation?,evening;morning,,,,Milla;Ben,,
625,Von wem ging die liebevolle Versöhnung aus?,initiator of reconciliation (beh.b.others.recon.init (variant for other persons)),who initiated the cordial reconciliation?,evening;morning,,,,Milla;Ben,,
626,Von wem ging die schwache Streitigkeit oder angespannte Meinungsverschiedenheit / Unstimmigkeit aus? ,initiator of dispute / disagreement (beh.b.partner.disagree.init),who initiated the weak dispute or tense disagreement?,stress;evening;morning,,,,Milla;Ben,,
627,Von wem ging die schwache Streitigkeit oder angespannte Meinungsverschiedenheit / Unstimmigkeit aus? ,initiator of dispute / disagreement (beh.b.others.disagree.init (variant for other persons)),who initiated the weak dispute or tense disagreement?,stress;evening;morning,,,,Milla;Ben,,
628,"Von wem ging die vertraute oder herzliche Aktivität, Unterhaltung oder Diskussion aus?",initiator of cordial activity / conversation / discussion (beh.b.partner.friendly.init),"who initiated the cordial activity, conversation or discussion?",activity;evening;morning,,,,Milla;Ben,,
629,"Von wem ging die vertraute oder herzliche Aktivität, Unterhaltung oder Diskussion aus?",initiator of cordial activity / conversation / discussion (beh.b.others.friendly.init (variant for other persons)),"who initiated the cordial activity, conversation or discussion?",activity;evening;morning,,,,Milla;Ben,,
630,Seit [Uhrzeit letzte Befragung oder heute morgen]: Haben Sie selbst gegenüber Ihrem Partner eine oder mehrere der folgenden Verhaltensweisen gezeigt?,own behavior in the relationship (beh.a1.partner),Since [time of the last survey or this morning]: have you yourself shown one or more of the following behaviors towards your partner?,evening;morning,,,,Milla;Ben,,
631,Seit [Uhrzeit letzte Befragung oder heute morgen]: Haben Sie selbst gegenüber Ihrem Partner eine oder mehrere der folgenden Verhaltensweisen gezeigt?,own behavior in the relationship (beh.a2.partner (extension of beh.a1.partner)),Since [time of the last survey or this morning]: Have you yourself shown one or more of the following behaviors towards other people?,evening;morning,,,,Milla;Ben,,
632,Seit [Uhrzeit letzte Befragung oder heute morgen]: Haben Sie selbst gegenüber anderen Personen eine oder mehrere der folgenden Verhaltensweisen gezeigt?,own behavior towards others (beh.a1.others (variant for other persons)),since [time of the last survey or this morning]: have you yourself shown one or more of the following behaviors towards other people?,evening;morning,,,,Milla;Ben,,
633,Seit [Uhrzeit letzte Befragung oder heute morgen]: Haben Sie selbst gegenüber anderen Personen eine oder mehrere der folgenden Verhaltensweisen gezeigt?,own behavior towards others (beh.a2.others (extension of beh.a1.others)),since [time of the last survey or this morning]: have you yourself shown one or more of the following behaviors towards other people?,evening;morning,,,,Milla;Ben,,
634,"Seit [Uhrzeit letzte Befragung oder heute morgen]: Haben Sie selbst eine oder mehrere der folgenden Verhaltensweisen gezeigt? Auch wenn Sie die Zeit seit der letzten Befragung alleine verbracht haben, könnten Sie z.B. eine nette Email geschrieben, einen Anruf ignoriert, eine Hotline kontaktiert haben.",own behavior when alone (beh.a1.alone (variant for being alone)),"since [time of the last survey or this morning]: have you shown one or more of the following behaviors? even if you have spent time alone since the last survey, you may have written a nice email, ignored a call, or contacted a hotline.",avoidance;evening;morning,,,,Milla;Ben,,
635,seit [uhrzeit letzte befragung oder heute morgen]: haben sie selbst eine oder mehrere der folgenden verhaltensweisen gezeigt?,own behavior when alone (beh.a2.alone (extension of beh.a1.alone)),since [time of the last survey or this morning]: have you shown one or more of the following behaviors?,evening;morning,,,,Milla;Ben,,
636,Seit der letzten Befragung: Hat Ihr Partner eine oder mehrere der folgenden Verhaltensweisen Ihnen gegenüber gezeigt?,partner behavior in the relationship (beh.p1.partner),since the last survey: has your partner showed one or more of the following behaviors towards you?,evening;morning,,,,Milla;Ben,,
637,Seit der letzten Befragung: Hat Ihr Partner eine oder mehrere der folgenden Verhaltensweisen Ihnen gegenüber gezeigt?,partner behavior in the relationship (beh.p2.partner (extension of beh.p1.partner)),since the last survey: has your partner showed one or more of the following behaviors towards you?,evening;morning,,,,Milla;Ben,,
638,Seit [Uhrzeit letzte Befragung oder heute morgen]: Haben andere Personen eine oder mehrere der folgenden Verhaltensweisen Ihnen gegenüber gezeigt?,behavior of others (beh.p1.others (variant for other persons)),since [time of the last survey or this morning]: have other people shown one or more of the following behaviors to you?,evening;morning,,,,Milla;Ben,,
639,Seit [Uhrzeit letzte Befragung oder heute morgen]: Haben andere Personen eine oder mehrere der folgenden Verhaltensweisen Ihnen gegenüber gezeigt?,behavior of others (beh.p2.others (extension of beh.p1.others)),since [time of the last survey or this morning]: have other people shown one or more of the following behaviors to you?,evening;morning,,,,Milla;Ben,,
640,Seit [Uhrzeit letzte Befragung oder heute morgen]: Hat jemand eine oder mehrere der folgenden Verhaltensweisen Ihnen gegenüber gezeigt?,behavior of others when one was alone (beh.p1.alone (variant for being alone)),since [time of the last survey or this morning]: has anyone shown any of the following behaviors to you?,evening;morning,,,,Milla;Ben,,
641,Seit [Uhrzeit letzte Befragung oder heute morgen]: Hat jemand eine oder mehrere der folgenden Verhaltensweisen Ihnen gegenüber gezeigt?,behavior of others when one was alone (beh.p2.alone (extension of beh.p1.alone)),since [time of the last survey or this morning]: has anyone shown any of the following behaviors to you?,evening;morning,,,,Milla;Ben,,
642,"Seit [Uhrzeit letzte Befragung oder heute morgen]: Wie war Ihr eigenes Verhalten in Bezug auf Ihren Partner? 1. Je dominanter, desto weiter oben tippen. 2. Je herzlicher, desto weiter rechts tippen.",own friendly and dominant behavior towards the partner (ipc.a.partner),"since [time of the last survey or this morning]: how was your own behavior towards your partner? 1. your answer should be higher the more dominant it was. 2. your answer should be farther on the right, the friendlier it was.since [time of the last survey or this morning]:",evening;morning,,,,Milla;Ben,,appraisal
643,"Seit [Uhrzeit letzte Befragung oder heute morgen]: Wie war Ihr eigenes Verhalten in Bezug auf andere Personen?  1. Je dominanter, desto weiter oben tippen.  2. Je herzlicher, desto weiter rechts tippen. ",dominant and friendly behaviour towards others (ipc.a.others (variant for other persons))dominant and friendly behaviour towards others (ipc.a.others (variant for other persons)),"since [time of the last survey or this morning]: how was your own behaviour towards other people?  1. your answer should be higher the more dominant it was. 2. your answer should be farther on the right, the friendlier it was.",evening;morning,,,,Milla;Ben,,appraisal
644,"Seit [Uhrzeit letzte Befragung oder heute morgen]: Wie war das Verhalten Ihres Partners in Bezug auf Sie? 1. Je dominanter, desto weiter oben tippen. 2. Je herzlicher, desto weiter rechts tippen.",partner friendly and dominant behavior (ipc.p.partner),"since [time of the last survey or this morning]: how was the behavior of your partner towards you? 1. your answer should be higher the more dominant it was. 2. your answer should be farther on the right, the friendlier it was.",evening;morning,,,,Milla;Ben,,appraisal
645,"Seit [Uhrzeit letzte Befragung oder heute morgen]: Wie war das Verhalten anderer Personen in Bezug auf Sie? 1. Je dominanter, desto weiter oben tippen.  2. Je herzlicher, desto weiter rechts tippen. ",dominant and friendly behaviour of others (ipc.p.others (variant for other persons)),"since [time of last survey or this morning]: how was other people's behaviour towards you? 1. your answer should be higher the more dominant it was. 2. your answer should be farther on the right, the friendlier it was.",evening;morning,,,,Milla;Ben,,appraisal
646,Wie glücklich sind Sie mit Ihrem eigenen Verhalten seit [Uhrzeit letzte Befragung oder heute morgen] Ihrem Partner gegenüber? ,satisfacation with behaviour towards partner (rs2.a.partner),how happy are you with your own behavior towards your partner since [time of last survey or this morning]?,positive affect;evening;morning,,,,Milla;Ben,,appraisal
647,Wie glücklich sind Sie mit Ihrem eigenen Verhalten anderen Personen gegenüber seit [Uhrzeit letzte Befragung oder heute morgen]?,satisfaction with behaviour towards others (rs2.a.others (variant for other persons)),how happy are you with your own behaviour towards other people since [time of last survey or this morning]?,positive affect;evening;morning,,,,Milla;Ben,,appraisal
648,Wie glücklich sind Sie mit dem Verhalten Ihres Partners seit [Uhrzeit letzte Befragung oder heute morgen] Ihnen gegenüber? ,satisfacation with partner's behaviour (rs2.p.partner),how happy are you with your partner's behavior since [time of last survey or this morning]? ,positive affect;evening;morning,,,,Milla;Ben,,appraisal
649,Wie glücklich sind Sie mit dem Verhalten anderer Personen Ihnen gegenüber seit [Uhrzeit letzte Befragung oder heute morgen]?,satisfaction with behaviour of others (rs2.p.others (variant for other persons)),how happy are you with other people's behaviour towards you since [time of last survey or this morning]?,positive affect;evening;morning,,,,Milla;Ben,,appraisal
650,Seit der letzten Befragung / dem Aufstehen heute morgen: Haben Sie eher Zuneigung oder eher Ablehnung von anderen Personen erfahren?,affection / rejection from others (comm.others),since the last survey / this morning: have you rather experienced affection or rejection from others?,evening;morning,,,,Milla;Ben,,
651,"Seit [Uhrzeit letzte Befragung oder heute morgen]: Hatten Sie eher Einfluss auf andere Personen oder haben Sie eher Hilflosigkeit gefühlt? z.B. andere von etwas überzeugt (oder eben nicht), andere aufgemuntert (oder eben nicht) oder sich gegen andere durchgesetzt (oder eben nicht).",influence on others (agen.others),"since [time of last survey or this morning]: have you had more influence on other people or have you felt more helplessness? e.g. convinced others of something (or not), cheered others up (or not) or prevailed against others (or not).",evening;morning,,,,Milla;Ben,,
652,"seit der letzten befragung / dem aufstehen heute morgen: haben sich eher sie oder eher andere personen bei diskussionen, unterhaltungen, entscheidungen an denen sie beteiligt waren durchgesetzt?",assertiveness towards others (agen.f),"since time of the last survey or this morning: were you or other people more likely to assert themselves in discussions, conversations, decisions in which you were involved?",evening;morning,,,,Milla;Ben,,
653,Wie selbstständig in der Beziehung fühlen Sie sich jetzt gerade?,momentary experience of independence in the relationship (status.a1),how independent in the relationship do you feel right now?,appraisal;evening;morning,,,,Milla;Ben,,
654,Wie einflussreich in der Beziehung fühlen Sie sich jetzt gerade?,momentary experience of influence in the relationship (status.a2),how influential in the relationship do you feel right now?,appraisal;evening;morning,,,,Milla;Ben,,
655,Wie emotional nahe fühlen Sie sich Ihrem Partner jetzt gerade?    Wie es gerade tatsächlich ist:,momentary experience of emotional closeness in the relationship (status.ios),how emotionally close do you feel to your partner right now?   how it is actually right now:,appraisal;evening;morning,,,,Milla;Ben,,
656,wo sind sie gerade?,location (place),where are you right now?,location;evening;morning,,,,Milla;Ben,,
657,Wer ist gerade anwesend (in ansprechbarer Nähe)?,presence of other persons (persons),who is present at the moment (addressable)?,evening;morning,,,,Milla;Ben,,social context
658,wie viel zeitdruck hatten sie bei der beantwortung dieser befragung?,time pressure during answering the survey (stress.event),how much time pressure did you have while answering this survey?,stress;evening;morning,,,,Milla;Ben,,methodological
659,Wie intensiv waren Sie gerade mit etwas beschäftigt?,intensity of current activity (stress1),how concentrated on doing something were you at the moment?,activity;cognition;evening;morning,,,,Milla;Ben,,
660,"Wie viel haben Sie in den nächsten zwei Stunden zu erledigen (sowohl beruflich, als auch privat)?",current workload (stress2),how much do you have to do in the next two hours (occupationally as well as privately)?,evening;morning,,,,Milla;Ben,,
661,"Wie viel Arbeit wartet in den nächsten zwei Stunden auf Sie (sowohl beruflich, als auch privat)?",current workload (stress.todo),how many tasks are on your to-do-list for the next two hours (occupationally as well as privately)?,morning,,,,Milla;Ben,,
662,Haben Sie sich während dieser Befragung mit Ihrem Partner über Ihre Antworten ausgetauscht?,exchange about answers with partner (exchange),did you discuss your answers with your partner during this survey?,evening;morning,,,,Milla;Ben,,methodological
663,Um welche Uhrzeit sind Sie heute morgen ungefähr aufgestanden?,wake up time (morgen),what time did you approximately get up this morning?,morning,,,,Milla;Ben,,sleep
664,ik heb goed geslapen ,sleep quality,i slept well ,sleep;morning,,,,Milla;Ben,,
665,ik heb lang genoeg geslapen ,sleep duration,i slept enough,sleep;morning,,,,Milla;Laura,,
666,denk aan de belangrijkste gebeurtenis die vandaag zal plaatsvinden. wat is het?,future event,think about the most important event that will take place today. what is it?,event;location;morning,,,,Milla;Laura,location,
667,ik heb zin in deze gebeurtenis,future orientation positive,i am looking forward to this event,event;morning,,,,Milla;Laura,,appraisal
668,ik zie ertegenop ,future orientation negative,i am dreading it [this event],event;morning,,,,Milla;Laura,,appraisal
669,deze gebeurtenis is belangrijk ,importance (future event),this event is important,event;morning,,,,Milla;Laura,,appraisal
670,ik heb controle over deze gebeurtenis,control (future event),i have control over this event,event;morning,,,,Milla;Laura,,appraisal
671,hoe verwacht ik dat deze gebeurtenis zal zijn?,intensity (future event),what do i expect this event to be like?,event;morning,,,,Milla;Laura,,appraisal
672,ik heb er vaak aan gedacht,rumination (future event),i have thought about it a lot,rumination;morning,,,,Milla;Laura,,
673,hoeveel heb ik het er met iemand over gehad?,sharing (future event),how much have i talked about it with someone?,morning,,,,Milla;Laura,,
674,"ik heb ongewone ervaringen, ik zie of hoor dingen die anderen niet zien of horen",psychoticism,i have unusual experiences,psychosis,,,,Milla;Laura,,
675,met wie ben ik?,social context,who is with me?,social context,,,,Milla;Laura,,
676,"met de mensen met wie ik nu ben, ben ik iets aan het doen (praten, leren, gamen, etc.)",social interaction,im interacting with my current company,social interaction,,,,Milla;Laura,,
677,wat ben ik aan het doen?,activity,what am i doing?,activity,,,,Milla;Laura,,
678,ik ben virtueel in contact met anderen,social interaction online,im interacting with others online,social interaction,,,,Milla;Laura,,
679,met wie ben ik virtueel in contact?,social context online,who am i in virtual contact with?,social context,,,,Milla;Laura,,
680,ik voel me op mijn gemak bij de mensen met wie ik online in contact ben ,experience of social context when in virtual company,i feel comfortable with the people im in online contact with,appraisal;social context;social support,,,,Milla;Laura,social context,
681,ik voel me gewaardeerd door de mensen met wie ik online in contact ben,experience of social context when in virtual company,i feel valued by the people im in online contact with,appraisal;social context;social support,,,,Milla;Laura,social context,
682,ik hoor bij de mensen met wie ik online in contact ben ,experience of social context when in virtual company,i belong with the people im in online contact with,appraisal;social context;social support,,,,Milla;Laura,social context,
683,waarom ben ik niet in online contact?,reasons for not interacting online,why am i not online in contact with others?,,,,,Milla;Laura,,
684,ik zou graag virtueel in contact zijn met anderen,experience of not interacting online,"i would like to be contact with others, virtually",appraisal,,,,Milla;Laura,,
685,ik heb er zelf voor gekozen om niet met anderen online in contact te zijn ,experience of not interacting online,i chose not to be in online contact with others,appraisal,,,,Milla;Laura,,
686,"ik voel me, online gezien, buitengesloten ",experience of not interacting online,"i feel, from an online perspective, excluded",appraisal,,,,Milla;Laura,,
687,denk aan de belangrijkste gebeurtenis voor jou in de afgelopen 2 uur. deze gebeurtenis was,intensity (past event),think about the most important event for you in the past 2 hours. this event was,event,,,,Milla;Laura,,
688,deze gebeurtenis was ,stress (past event),this event was,event;stress,,,,Milla;Laura,,
689,ik heb er vaak aan gedacht (belangrijkste gebeurtenis in de afgelopen 2 uur),past event rumination,i have thought about it a lot (most important event in the past 2 hours),event;rumination,,,,Milla;Laura,,
690,hoeveel heb ik het er met iemand over gehad? (belangrijkste gebeurtenis in de afgelopen 2 uur),past event sharing,how much have i talked about it with someone? (most important event in the past 2 hours),event,,,,Milla;Laura,,
691,denk aan de belangrijkste situatie voor jou in de komende 2 uurdenk aan de belangrijkste situatie voor jou in de komende 2 uur,future event ,think about the most important situation for you in the next 2 hoursthink about the most important situation for you in the next 2 hours,event,,,,Milla;Laura,,
692,ik heb zin in deze situatie,future orientation positive,[how much] am i looking forward to this situation?,,,,,Milla;Laura,,appraisal
693,denk aan de meest negatieve gebeurtenis van vandaag. wat was het? ,most negative event of the day,think about the most negative event of today. what was it?,event;evening,,,,Milla;Laura,,appraisal
694,(meest negatieve gebeurtenis) deze gebeurtenis was,intensity (most negative event of the day),(most negative event) this event was ,event;evening,,,,Milla;Laura,,appraisal
695,(meest negatieve gebeurtenis) ik had controle over deze gebeurtenis,control (most negative event of the day),(most negative event) i had control over this event,event;evening,,,,Milla;Laura,,appraisal
696,(meest negatieve gebeurtenis) deze gebeurtenis was belangrijk,importance (most negative event of the day),(most negative event) this event was important,event;evening,,,,Milla;Laura,,appraisal
697,(meest negatieve gebeurtenis) hoeveel heb ik het er met iemand over gehad? ,sharing (most negative event of the day),(most negative event) how much have i talked about it with someone?,event;evening,,,,Milla;Laura,,emotion regulation
698,(meest negatieve gebeurtenis) ik heb er nog vaak aan gedacht,rumination (most negative event of the day),(most negative event) i have thought about it a lot,event;rumination;evening,,,,Milla;Laura,,emotion regulation
699,(meest negatieve gebeurtenis) ik heb mijn emoties getoond,emotion expression (most negative event of the day),(most negative event) i expressed my emotions,event;evening,,,,Milla;Laura,,emotion regulation
700,(meest negatieve gebeurtenis) ik probeerde mijn emoties te onderdrukken,suppression (most negative event of the day),(most negative event) i tried to hide my emotions,event;evening,,,,Milla;Laura,,emotion regulation
701,(meest negatieve gebeurtenis) ik heb geprobeerd mezelf af te leiden door andere activiteiten,behavioral distraction (most negative event of the day),(most negative event) i tried to distract myself with other activities,attention;event;evening,,,,Milla;Laura,,emotion regulation
702,(meest negatieve gebeurtenis) ik probeerde de situatie te veranderen,situation modification (most negative event of the day),(most negative event) i tried to change the situation,event;evening,,,,Milla;Laura,,emotion regulation
703,(meest negatieve gebeurtenis) ik heb mijn emoties gewoon aanvaard,acceptance (most negative event of the day),(most negative event) i just accepted my emotions,event;evening,,,,Milla;Laura,,emotion regulation
704,(meest negatieve gebeurtenis) ik heb er op een andere manier naar gekeken,reappraisal (most negative event of the day),(most negative event) i looked at it from a different perspective,appraisal;event;evening,,,,Milla;Laura,,emotion regulation
705,denk aan de meest positieve gebeurtenis van vandaag. wat was het? ,most positive event of the day,think about the most positive event of today. what was it?,event;evening,,,,Milla;Laura,,
706,(meest positieve gebeurtenis) deze gebeurtenis was,intensity (most positive event of the day),(most positive event) this event was,event;evening,,,,Milla;Laura,,appraisal
707,(meest positieve gebeurtenis) ik had controle over deze gebeurtenis,control (most positive event of the day),(most positive event) i had control over this event,event;evening,,,,Milla;Laura,,appraisal
708,(meest positieve gebeurtenis) deze gebeurtenis was belangrijk,importance (most positive event of the day),(most positive event) this event was important,event;evening,,,,Milla;Laura,,appraisal
709,(meest positieve gebeurtenis) hoeveel heb ik het er met iemand over gehad?,sharing (most positive event of the day),(most positive event) how much have i talked about it with someone?,event;evening,,,,Milla;Laura,,emotion regulation
710,(meest positieve gebeurtenis) ik heb er nog vaak aan gedacht ,rumination (most positive event of the day),(most positive event) i have thought about it a lot,event;rumination;evening,,,,Milla;Laura,,emotion regulation
711,(meest positieve gebeurtenis) ik heb mijn emoties gewoon aanvaard,acceptance (most positive event of the day),(most positive event) i just accepted my emotions,event;evening,,,,Milla;Laura,,emotion regulation
712,(meest positieve gebeurtenis) ik heb mijn emoties getoond,emotion expression (most positive event of the day),(most positive event) i expressed my emotions,event;evening,,,,Milla;Laura,,emotion regulation
713,(meest positieve gebeurtenis) ik probeerde mijn emoties te onderdrukken,suppression (most positive event of the day),(most positive event) i tried to hide my emotions,event;evening,,,,Milla;Laura,,emotion regulation
714,ik voel me vrolijk ,positive affect,i feel cheerful,positive affect,,,,Milla;Laura,,
715,ik voel me geïrriteerd,negative affect,i feel irritated,negative affect,,,,Milla;Laura,,
716,ik voel me angstig ,negative affect,i feel anxious,anxiety;negative affect;worry,,,,Milla;Laura,worry,
717,ik voel me tevreden ,positive affect,i feel satisfied,positive affect,,,,Milla;Laura,,
718,ik voel me onzeker ,negative affect,i feel insecure,negative affect;self-esteem,,,,Milla;Laura,negative affect,
719,ik voel me eenzaam ,loneliness/negative affect,i feel lonely,negative affect,,,,Milla;Laura,,
720,ik voel me ontspannen,positive affect,i feel relaxed,positive affect,,,,Milla;Laura,,
721,ik voel me wantrouwig,psychoticism,i feel paranoid,psychosis,,,,Milla;Laura,,
722,ik voel me verdrietig ,negative affect,i feel sad,negative affect,,,,Milla;Laura,,
723,ik voel me gestresst,negative affect,i feel stressed,negative affect;stress,,,,Milla;Laura,,
724,ik voel me rusteloos,negative affect,i feel restless,negative affect,,,,Milla;Laura,,
